{
  "kfms_version": "1.0",
  "project": {
    "name": "NEURODECK",
    "id": "neurodeck",
    "description": "AI-powered terminal OS for Steam Deck \u2014 LLM chat, live canvas, PTY shell, autonomous agent, vector memory, and gamepad-native navigation in one 1280\u00d7800 window.",
    "repo": "https://github.com/khaoticdev62/NEURODECK"
  },
  "version": "1.8.0",
  "codename": {
    "name": "Ptah",
    "minor_line": 8,
    "registry_index": 8
  },
  "tag": "v1.8.0-ptah",
  "build": {
    "git_sha": "892e5fc7b0dbcb6ed8d8cb40d6a24c3fb0bd9379",
    "git_tag": null,
    "built_at_utc": "2026-06-15T14:15:17Z",
    "dirty": false
  },
  "studio": {
    "name": "Khaotic Labs",
    "governance": {
      "codename_unique_per_major": true,
      "no_secrets_in_build": true,
      "loose_zone": ".loose/",
      "build_on_release": true,
      "build_trigger_pattern": "v[0-9]+.[0-9]+.[0-9]+-*",
      "build_targets": [
        "windows",
        "appimage",
        "flatpak",
        "aur"
      ],
      "build_script": "scripts/powershell/build.ps1",
      "release_policy": {
        "go_threshold": 85,
        "hold_threshold": 60,
        "penalties": {
          "metadata": 35,
          "diff_hygiene": 20,
          "workspace_state": 20,
          "loose_root_files": 10,
          "hardening_check": 30,
          "cargo_check": 25,
          "cargo_test": 25,
          "frontend_build": 20
        }
      }
    }
  }
}
